{
  "$schema": "https://json-schema.org/draft/2020-12/schema",
  "title": "VDR evidence basis list",
  "description": "Schema for data/evidence_basis.json: the closed list of bases an evidence edge may give for lowering a VDR factor.",
  "type": "object",
  "additionalProperties": false,
  "required": ["description", "source", "read_at", "bases"],
  "properties": {
    "description": {
      "type": "string",
      "minLength": 1,
      "description": "What the list is, where it comes from and what it deliberately leaves out."
    },
    "source": {
      "type": "string",
      "minLength": 1,
      "description": "Where the list was read from."
    },
    "read_at": {
      "type": "string",
      "format": "date",
      "description": "The date the source was read."
    },
    "bases": {
      "type": "array",
      "minItems": 1,
      "description": "The allowed bases, each unique by key.",
      "items": {
        "type": "object",
        "additionalProperties": false,
        "required": ["key", "description"],
        "properties": {
          "key": {
            "type": "string",
            "pattern": "^[a-z][a-z_]*$",
            "description": "The value written to the basis property of an evidence edge."
          },
          "description": {
            "type": "string",
            "minLength": 1,
            "description": "What the basis means, in the source's words."
          }
        }
      }
    }
  }
}
